{
  "$schema": "https://json-schema.org/draft/2020-12/schema",
  "title": "BatteryLake global metadata index",
  "description": "Generated by metadata/scripts/generate/build.py. One flat row per dataset for filtering, plus precomputed facet vocabularies. Never edit by hand: edit a dataset record or the curation file and rebuild.",
  "type": "object",
  "required": [
    "schema_version",
    "content_hash",
    "generated",
    "record_schema",
    "counts",
    "facets",
    "datasets"
  ],
  "additionalProperties": false,
  "properties": {
    "$schema": {
      "type": "string"
    },
    "schema_version": {
      "const": "2.0.0"
    },
    "content_hash": {
      "type": "string",
      "description": "sha256 over the dataset rows, so two copies of this file can detect whether their underlying data has diverged."
    },
    "generated": {
      "type": "string",
      "format": "date"
    },
    "record_schema": {
      "type": "string"
    },
    "description": {
      "type": "string"
    },
    "counts": {
      "type": "object",
      "additionalProperties": {
        "type": "integer",
        "minimum": 0
      }
    },
    "facets": {
      "type": "object",
      "description": "field name -> sorted list of every value present, for building filter UI without scanning the rows",
      "additionalProperties": {
        "type": "array"
      }
    },
    "datasets": {
      "type": "array",
      "minItems": 1,
      "items": {
        "type": "object",
        "required": [
          "dataset_id",
          "record_path",
          "n_entities",
          "has_waveforms"
        ],
        "properties": {
          "dataset_id": {
            "type": "string"
          },
          "record_path": {
            "type": "string",
            "pattern": "^datasets/dataset_[A-Za-z0-9_]+\\.json$"
          },
          "ref_name": {
            "type": [
              "string",
              "null"
            ]
          },
          "ref_name_aliases": {
            "type": "array",
            "items": {
              "type": "string"
            }
          },
          "dataset_name": {
            "type": [
              "string",
              "null"
            ]
          },
          "institution": {
            "type": [
              "string",
              "null"
            ]
          },
          "year": {
            "type": [
              "integer",
              "null"
            ]
          },
          "doi": {
            "type": [
              "string",
              "null"
            ]
          },
          "manufacturer": {
            "type": [
              "string",
              "null"
            ]
          },
          "model": {
            "type": [
              "string",
              "null"
            ]
          },
          "chemistry_is_multi": {
            "type": "boolean"
          },
          "nominal_capacity_Ah": {
            "type": [
              "number",
              "null"
            ]
          },
          "nominal_voltage_V": {
            "type": [
              "number",
              "null"
            ]
          },
          "voltage_min_V": {
            "type": [
              "number",
              "null"
            ]
          },
          "voltage_max_V": {
            "type": [
              "number",
              "null"
            ]
          },
          "temperature_min_C": {
            "type": [
              "number",
              "null"
            ]
          },
          "temperature_max_C": {
            "type": [
              "number",
              "null"
            ]
          },
          "charge_c_rate_max": {
            "type": [
              "number",
              "null"
            ]
          },
          "discharge_c_rate_max": {
            "type": [
              "number",
              "null"
            ]
          },
          "c_rate_profile": {
            "type": [
              "string",
              "null"
            ]
          },
          "protocol_class": {
            "type": [
              "string",
              "null"
            ]
          },
          "charging_profile": {
            "enum": [
              "CC-CV",
              "dynamic",
              "multi-rate",
              null
            ]
          },
          "aging_type": {
            "type": [
              "string",
              "null"
            ]
          },
          "application_domain": {
            "type": [
              "string",
              "null"
            ]
          },
          "entity_type": {
            "type": "string"
          },
          "n_entities": {
            "type": [
              "integer",
              "null"
            ]
          },
          "n_cycles_total": {
            "type": [
              "integer",
              "null"
            ]
          },
          "cycles_per_entity_median": {
            "type": [
              "number",
              "null"
            ]
          },
          "signals": {
            "type": "array",
            "items": {
              "type": "string"
            }
          },
          "supported_tasks": {
            "type": "array",
            "items": {
              "type": "string"
            }
          },
          "source_format": {
            "type": "array",
            "items": {
              "type": "string"
            }
          },
          "quality_flags": {
            "type": "array",
            "items": {
              "type": "string"
            }
          },
          "confidence": {
            "enum": [
              "verified",
              "asserted",
              "inferred"
            ]
          },
          "n_entities_declared": {
            "type": [
              "integer",
              "null"
            ]
          },
          "n_raw_files": {
            "type": [
              "integer",
              "null"
            ]
          },
          "raw_bytes": {
            "type": [
              "integer",
              "null"
            ]
          },
          "has_waveforms": {
            "type": "boolean"
          },
          "notes": {
            "description": "identity.notes of the record: the registry-style one-line description.",
            "type": [
              "string",
              "null"
            ]
          },
          "form_factors": {
            "type": "array",
            "items": {
              "type": "string"
            }
          },
          "cell_format_codes": {
            "type": "array",
            "items": {
              "type": "string"
            }
          },
          "cathode_chemistries": {
            "type": "array",
            "items": {
              "type": "string"
            }
          },
          "anode_chemistries": {
            "type": "array",
            "items": {
              "type": "string"
            }
          },
          "nominal_capacities_Ah": {
            "type": "array",
            "items": {
              "type": "number"
            }
          },
          "charge_profiles": {
            "type": "array",
            "items": {
              "type": "string"
            }
          },
          "discharge_profiles": {
            "type": "array",
            "items": {
              "type": "string"
            }
          }
        }
      }
    }
  }
}
