{
 "$schema": "./schema/batterylake-index-2.0.json",
 "schema_version": "2.0.0",
 "generated": "2026-10-14",
 "content_hash": "8db982e4a67dbd9cde7dfc4de7fa858cb99de1d225a533e5ce707794b0af057f",
 "record_schema": "./schema/batterylake-dataset-2.0.json",
 "description": "Single source of truth for BatteryLake dataset metadata. One row per dataset; record_path points at the full record, which additionally carries per-cell rows. Read-only consumers should filter on this file and open a record only when per-cell detail is needed.",
 "counts": {
  "datasets": 40,
  "entities": 3451,
  "raw_files": 4135,
  "raw_bytes": 300770200085
 },
 "facets": {
  "form_factors": [
   "cylindrical",
   "pack",
   "pouch",
   "prismatic"
  ],
  "cell_format_codes": [
   "14500",
   "18650",
   "21700",
   "26650",
   "302030",
   "502030",
   "533459"
  ],
  "cathode_chemistries": [
   "LCO",
   "LCO-NCO",
   "LCO-NMC",
   "LFP",
   "LMO",
   "LMO-LNO",
   "NCA",
   "NMC",
   "NMC-LMO",
   "NMC811"
  ],
  "anode_chemistries": [
   "LTO",
   "Si-graphite",
   "graphite"
  ],
  "charge_profiles": [
   "CC",
   "CC-CV",
   "dynamic",
   "multi-stage CC",
   "multi-stage CC-CV",
   "pulse"
  ],
  "discharge_profiles": [
   "CC",
   "CC-CV",
   "dynamic",
   "multi-stage CC",
   "pulse"
  ],
  "aging_type": [
   "abuse_mechanical",
   "abuse_thermal",
   "calendar",
   "characterization",
   "cyclic",
   "field",
   "mixed",
   "profile",
   "second_life"
  ],
  "application_domain": [
   "EV_field",
   "HEV",
   "eVTOL",
   "grid_storage",
   "lab",
   "safety"
  ],
  "protocol_class": [
   "CC-CV",
   "RPT_only",
   "abuse",
   "calendar_hold",
   "drive_cycle",
   "mixed",
   "multistage_CC",
   "pulse"
  ],
  "charging_profile": [
   "CC-CV",
   "dynamic",
   "multi-rate"
  ],
  "c_rate_profile": [
   "constant",
   "drive_cycle",
   "dynamic",
   "multistage"
  ],
  "entity_type": [
   "cell",
   "module",
   "vehicle"
  ],
  "supported_tasks": [
   "RUL",
   "SOC",
   "SOH",
   "anomaly",
   "characterization",
   "fault_diagnosis",
   "thermal_safety"
  ],
  "signals": [
   "capacity",
   "charge_capacity",
   "current",
   "cycle_index",
   "discharge_capacity",
   "displacement",
   "eis",
   "energy",
   "force",
   "internal_resistance",
   "ocv",
   "power",
   "soc",
   "step_type",
   "temperature",
   "time",
   "voltage"
  ],
  "source_format": [
   "csv",
   "json",
   "mat",
   "mpr",
   "mps",
   "mpt",
   "pkl",
   "txt",
   "xls",
   "xlsx"
  ],
  "quality_flags": [
   "duplicate_of_other_dataset",
   "incomplete_raw_files",
   "multi_chemistry",
   "partial_raw",
   "sample_only_raw",
   "shared_cells_with_other_dataset",
   "unreadable_raw_files",
   "voltage_excursion_above_cutoff",
   "voltage_excursion_below_cutoff"
  ],
  "institution": [
   "Beihang University",
   "CALCE, University of Maryland",
   "Carnegie Mellon University",
   "Chongqing University; Aalborg University",
   "Hawaii Natural Energy Institute",
   "Huazhong University of Science and Technology",
   "IVST / Changan Automobile",
   "Imperial College London",
   "Iowa State University and Iowa Lakes Community College",
   "Karlsruhe Institute of Technology",
   "Karlsruhe Institute of Technology (KIT)",
   "McMaster University and Politecnico di Torino",
   "Munich University of Applied Sciences (HM)",
   "NASA Prognostics Center of Excellence",
   "Oak Ridge National Laboratory and Sandia National Laboratories",
   "RWTH Aachen University",
   "Sandia National Laboratories",
   "Stanford University and SLAC (Chueh group)",
   "Stanford University, MIT and Toyota Research Institute",
   "Stanford University, Onori Lab",
   "Technical University of Munich",
   "Technische Hochschule Ingolstadt (THI)",
   "Tsinghua Berkeley Shenzhen Institute",
   "Tsinghua University",
   "UL Research Institutes and Purdue University",
   "Universite Grenoble Alpes and Universite Lyon 1",
   "University of Cassino and Southern Lazio",
   "University of Malaya",
   "University of Oxford, Howey Research Group",
   "University of Warwick; dataset collected at the Stanford Energy Control Laboratory (Onori Lab)",
   "VITO / EnergyVille (EVERLASTING project)",
   "Xi'an Jiaotong University"
  ],
  "year": [
   2007,
   2013,
   2017,
   2018,
   2019,
   2020,
   2021,
   2022,
   2023,
   2024,
   2025
  ],
  "manufacturer": [
   "A123",
   "Kokam",
   "LG",
   "LG Chem",
   "LISHEN",
   "Lithiumwerks",
   "Molicel",
   "O'Cell New Energy Technology Co., Ltd",
   "Panasonic",
   "Samsung SDI",
   "Sanyo/Panasonic",
   "Shenzhen Honghaosheng Electronics",
   "Sony-Murata"
  ]
 },
 "datasets": [
  {
   "dataset_id": "dataset_01",
   "ref_name": "2007_NASA_PCoE_LCO_18650_1C_1C_25T",
   "ref_name_aliases": [],
   "dataset_name": "NASA PCoE Battery Aging",
   "notes": "34 LCO 18650 cells; charge/discharge cycling with interleaved EIS sweeps (0.1 Hz-5 kHz) to 30% fade; 4-44 °C; CC-CV charge, 1-4 A discharge",
   "institution": "NASA Prognostics Center of Excellence",
   "year": 2007,
   "doi": null,
   "manufacturer": null,
   "model": null,
   "chemistry_is_multi": false,
   "form_factors": [
    "cylindrical"
   ],
   "cell_format_codes": [
    "18650"
   ],
   "cathode_chemistries": [
    "LCO"
   ],
   "anode_chemistries": [],
   "electrode_combinations": [],
   "nominal_capacities_Ah": [
    2.0
   ],
   "charge_profiles": [
    "CC-CV"
   ],
   "discharge_profiles": [
    "CC",
    "dynamic"
   ],
   "profile_combinations": [
    {
     "charge": "CC-CV",
     "discharge": "CC"
    },
    {
     "charge": "CC-CV",
     "discharge": "dynamic"
    }
   ],
   "single_side_profiles": [],
   "dynamic_subprofiles": [
    {
     "name": "Square wave",
     "kind": "square_wave",
     "detail": "0.05 Hz, 50% duty, 4 A for B0025-B0027 and 2 A for B0028"
    }
   ],
   "rate_combinations": [
    {
     "charge_profile": "CC-CV",
     "charge_c_rate": 0.75,
     "discharge_profile": "CC",
     "discharge_c_rate": 0.5
    },
    {
     "charge_profile": "CC-CV",
     "charge_c_rate": 0.75,
     "discharge_profile": "CC",
     "discharge_c_rate": 1.0
    },
    {
     "charge_profile": "CC-CV",
     "charge_c_rate": 0.75,
     "discharge_profile": "CC",
     "discharge_c_rate": 2.0
    },
    {
     "charge_profile": "CC-CV",
     "charge_c_rate": 0.75,
     "discharge_profile": "dynamic",
     "discharge_c_rate": null,
     "discharge_subprofile": "Square wave"
    }
   ],
   "nominal_capacity_Ah": 2.0,
   "nominal_voltage_V": null,
   "voltage_min_V": 2.0,
   "voltage_max_V": 4.2,
   "temperature_min_C": 4.0,
   "temperature_max_C": 44.0,
   "charge_c_rate_max": 0.75,
   "discharge_c_rate_max": 2.0,
   "c_rate_profile": "constant",
   "protocol_class": "CC-CV",
   "charging_profile": "multi-rate",
   "aging_type": "cyclic",
   "application_domain": "lab",
   "entity_type": "cell",
   "n_entities": 34,
   "n_entities_declared": 34,
   "n_cycles_total": 2794,
   "cycles_per_entity_median": 69.5,
   "n_raw_files": 1,
   "raw_bytes": 209708670,
   "signals": [
    "current",
    "discharge_capacity",
    "eis",
    "temperature",
    "time",
    "voltage"
   ],
   "has_waveforms": true,
   "supported_tasks": [
    "SOH",
    "RUL"
   ],
   "source_format": [
    "mat"
   ],
   "quality_flags": [
    "voltage_excursion_below_cutoff",
    "voltage_excursion_above_cutoff"
   ],
   "confidence": "verified",
   "record_path": "datasets/dataset_01.json"
  },
  {
   "dataset_id": "dataset_02",
   "ref_name": "2013_CALCE_UMD_LCO_Prismatic_1.1Ah_0.5C_1C_25T",
   "ref_name_aliases": [
    "2013_CALCE_UMD_LCO_18650_0.5C_1C_25T"
   ],
   "dataset_name": "CALCE CS2 Battery Aging",
   "notes": "6 LCO prismatic cells; CS2 type; Arbin workbooks; CC-CV charge at 0.5C; 0.5C, 1C, alternating-level and partial-SOC discharge groups",
   "institution": "CALCE, University of Maryland",
   "year": 2013,
   "doi": null,
   "manufacturer": null,
   "model": null,
   "chemistry_is_multi": false,
   "form_factors": [
    "prismatic"
   ],
   "cell_format_codes": [],
   "cathode_chemistries": [
    "LCO"
   ],
   "anode_chemistries": [],
   "electrode_combinations": [],
   "nominal_capacities_Ah": [
    1.1
   ],
   "charge_profiles": [
    "CC-CV"
   ],
   "discharge_profiles": [
    "CC"
   ],
   "profile_combinations": [
    {
     "charge": "CC-CV",
     "discharge": "CC"
    }
   ],
   "single_side_profiles": [],
   "dynamic_subprofiles": [],
   "rate_combinations": [
    {
     "charge_profile": "CC-CV",
     "charge_c_rate": 0.5,
     "discharge_profile": "CC",
     "discharge_c_rate": 0.5
    },
    {
     "charge_profile": "CC-CV",
     "charge_c_rate": 0.5,
     "discharge_profile": "CC",
     "discharge_c_rate": 1.0
    }
   ],
   "nominal_capacity_Ah": 1.1,
   "nominal_voltage_V": null,
   "voltage_min_V": 2.7,
   "voltage_max_V": 4.2,
   "temperature_min_C": null,
   "temperature_max_C": null,
   "charge_c_rate_max": 0.5,
   "discharge_c_rate_max": 1.0,
   "c_rate_profile": "constant",
   "protocol_class": "CC-CV",
   "charging_profile": "multi-rate",
   "aging_type": "cyclic",
   "application_domain": "lab",
   "entity_type": "cell",
   "n_entities": 6,
   "n_entities_declared": 6,
   "n_cycles_total": 5686,
   "cycles_per_entity_median": 956.0,
   "n_raw_files": 6,
   "raw_bytes": 248444385,
   "signals": [
    "charge_capacity",
    "current",
    "cycle_index",
    "discharge_capacity",
    "energy",
    "internal_resistance",
    "step_type",
    "time",
    "voltage"
   ],
   "has_waveforms": true,
   "supported_tasks": [
    "SOH",
    "RUL"
   ],
   "source_format": [
    "xlsx"
   ],
   "quality_flags": [
    "voltage_excursion_above_cutoff"
   ],
   "confidence": "verified",
   "record_path": "datasets/dataset_02.json"
  },
  {
   "dataset_id": "dataset_03",
   "ref_name": "2019_Stanford_MIT_TRI_LFP_18650_MultiC_30T",
   "ref_name_aliases": [],
   "dataset_name": "Stanford-MIT-TRI Fast Charging",